{
  "project": {
    "project_id": "ANON-001",
    "project_name": "Anonymized Homestead Site 001",
    "privacy_status": "anonymized_example_no_private_identifiers",
    "context": "Small homestead example with driveway standing water, downspout/foundation concern, clay-like soil report, sunny lawn, deer uncertainty, and native edible/pollinator goals."
  },
  "observations": [
    {"id":"obs_001","claim_type":"client_reported_fact","summary":"Client reports seasonal standing water near the east driveway edge.","source":"intake","evidence_ids":[],"confidence":"medium","verification_status":"pending","location_ref":"driveway_east","notes":"Inspect after rainfall."},
    {"id":"obs_002","claim_type":"client_reported_fact","summary":"Roof downspout is reported to drain toward a foundation bed.","source":"intake","evidence_ids":[],"confidence":"medium","verification_status":"pending","location_ref":"foundation_bed_east","notes":"Confirm discharge location and grading."},
    {"id":"obs_003","claim_type":"client_reported_fact","summary":"Client reports clay-like soil, but no soil texture or infiltration test has been completed.","source":"intake","evidence_ids":[],"confidence":"low","verification_status":"pending","location_ref":"site_general","notes":"Treat as an assumption until tested."},
    {"id":"obs_004","claim_type":"observed_fact","summary":"A sunny south-facing lawn area is available as a candidate planting zone.","source":"example_seed_data","evidence_ids":[],"confidence":"medium","verification_status":"pending","location_ref":"south_lawn","notes":"Sun exposure should be field-checked seasonally."},
    {"id":"obs_005","claim_type":"unknown","summary":"Deer pressure is unknown and may affect plant guild design and protection strategy.","source":"intake","evidence_ids":[],"confidence":"unknown","verification_status":"pending","location_ref":"site_general","notes":"Ask client and inspect browse evidence."}
  ],
  "predictions": [
    {"id":"pred_001","claim_type":"prediction","summary":"Water may concentrate along the east driveway edge during heavy rain.","source":"observations","evidence_ids":["obs_001"],"confidence":"medium","verification_status":"pending","based_on":["obs_001"],"risk_if_wrong":"A rain garden or infiltration feature could be misplaced.","verification_required":true,"verification_tasks":["verify_001","verify_002"],"notes":"Candidate only until observed during or after rainfall."},
    {"id":"pred_002","claim_type":"prediction","summary":"Foundation moisture risk may exist if downspout water is concentrating near the foundation bed.","source":"observations","evidence_ids":["obs_002"],"confidence":"medium","verification_status":"pending","based_on":["obs_002"],"risk_if_wrong":"Unnecessary intervention or missed drainage issue.","verification_required":true,"verification_tasks":["verify_003"],"notes":"Check discharge location and grading."},
    {"id":"pred_003","claim_type":"prediction","summary":"Plant guild design may require deer protection if browse pressure is confirmed.","source":"observations","evidence_ids":["obs_005"],"confidence":"unknown","verification_status":"pending","based_on":["obs_005"],"risk_if_wrong":"Unprotected edible or shrub plantings may fail.","verification_required":true,"verification_tasks":["verify_004"],"notes":"Do not finalize vulnerable species without deer review."}
  ],
  "risks": [
    {"id":"risk_001","claim_type":"risk","summary":"Standing water or failed infiltration feature if soil infiltration is poor.","source":"predictions","evidence_ids":["pred_001","obs_003"],"confidence":"medium","verification_status":"pending","severity":"high","likelihood":"unknown","mitigation":"Perform infiltration test before finalizing rain garden or infiltration basin.","notes":"Blocks final water-feature recommendation."},
    {"id":"risk_002","claim_type":"risk","summary":"Foundation moisture risk if runoff is redirected too close to the structure.","source":"predictions","evidence_ids":["pred_002"],"confidence":"medium","verification_status":"pending","severity":"high","likelihood":"unknown","mitigation":"Confirm grading, foundation distance, and safe discharge path before intervention.","notes":"Requires human review."},
    {"id":"risk_003","claim_type":"risk","summary":"Plant loss risk if deer pressure is present and protection is not included.","source":"predictions","evidence_ids":["pred_003"],"confidence":"unknown","verification_status":"pending","severity":"medium","likelihood":"unknown","mitigation":"Inspect browse pressure and include cages, fencing, or deer-resistant palette if needed.","notes":"Do not overpromise plant establishment."}
  ],
  "verification_tasks": [
    {"id":"verify_001","claim_type":"verification_task","summary":"Perform simple infiltration test in candidate rain garden zone.","source":"safety_gate","evidence_ids":["pred_001","risk_001"],"confidence":"high","verification_status":"pending","priority":"high","method":"Use an appropriate field infiltration test before final design.","status":"pending","notes":"Required before final water intervention."},
    {"id":"verify_002","claim_type":"verification_task","summary":"Walk the driveway edge after rainfall to confirm actual flow path and standing water pattern.","source":"safety_gate","evidence_ids":["pred_001"],"confidence":"high","verification_status":"pending","priority":"high","method":"Observe within 24 hours of rain and photograph flow or ponding areas.","status":"pending","notes":"Confirms or contradicts candidate flow path."},
    {"id":"verify_003","claim_type":"verification_task","summary":"Confirm downspout discharge location, foundation distance, and safe overflow route.","source":"safety_gate","evidence_ids":["pred_002","risk_002"],"confidence":"high","verification_status":"pending","priority":"high","method":"Field observation plus slope/grading check around foundation bed.","status":"pending","notes":"Required before redirecting water."},
    {"id":"verify_004","claim_type":"verification_task","summary":"Assess deer pressure and browse evidence before final plant selection.","source":"safety_gate","evidence_ids":["obs_005"],"confidence":"medium","verification_status":"pending","priority":"medium","method":"Ask client and inspect browse lines, tracks, scat, and neighboring plant damage.","status":"pending","notes":"Determines plant protection strategy."},
    {"id":"verify_005","claim_type":"verification_task","summary":"Call utility locate before any digging or staking that could disturb buried infrastructure.","source":"safety_gate","evidence_ids":[],"confidence":"high","verification_status":"pending","priority":"high","method":"Use appropriate local utility locate process before ground disturbance.","status":"pending","notes":"Required safety gate."}
  ],
  "interventions": [
    {"id":"int_001","claim_type":"design_candidate","summary":"Candidate native rain garden or infiltration planting near driveway runoff zone.","source":"predictions","evidence_ids":["pred_001","risk_001","verify_001","verify_005"],"confidence":"medium","verification_status":"pending","status":"candidate","supported_by":["pred_001","obs_001"],"benefits":["reduce runoff velocity","increase infiltration if soils allow","provide native pollinator habitat"],"risks":["poor infiltration","salt exposure from driveway runoff","foundation moisture risk if poorly placed","utility conflict if digging occurs"],"required_verification":["verify_001","verify_002","verify_003","verify_005"],"maintenance_load":"medium","implementation_complexity":"medium","client_fit":"high","notes":"Do not finalize until hydrology, utilities, and infiltration are checked."},
    {"id":"int_002","claim_type":"design_candidate","summary":"South-facing native edible and pollinator guild with deer-protection decision after field review.","source":"observations","evidence_ids":["obs_004","obs_005","verify_004"],"confidence":"medium","verification_status":"pending","status":"candidate","supported_by":["obs_004"],"benefits":["adds pollinator habitat","can include edible shrubs/herbs","uses sunny lawn edge"],"risks":["deer browse","maintenance overload during establishment","plant mismatch if soil moisture is misread"],"required_verification":["verify_004","verify_001"],"maintenance_load":"medium","implementation_complexity":"low","client_fit":"high","notes":"Prefer native, resilient species and staged planting."}
  ],
  "design_scenarios": [
    {"id":"scenario_001","name":"Observation-first stabilization","summary":"Delay final water features until rain-event observation, infiltration testing, and utility checks are complete.","benefits":["lowest risk","improves confidence","protects foundation and utilities"],"risks":["slower visible progress"],"unknowns":["actual infiltration rate","confirmed flow path"],"verification_needed":["verify_001","verify_002","verify_003","verify_005"],"maintenance_load":"low","implementation_complexity":"low","recommended_phase":"Phase 1","confidence":"high"},
    {"id":"scenario_002","name":"Candidate rain garden after verification","summary":"Install a native rain garden only if field checks confirm safe location, infiltration, overflow, and utility clearance.","benefits":["stormwater benefit","pollinator habitat","client-visible improvement"],"risks":["failed infiltration if soil is unsuitable","foundation moisture risk if placed poorly"],"unknowns":["infiltration rate","overflow route"],"verification_needed":["verify_001","verify_002","verify_003","verify_005"],"maintenance_load":"medium","implementation_complexity":"medium","recommended_phase":"Phase 2","confidence":"medium"},